full,abbr
IEEE TRANSACTIONS ON AEROSPACE AND ELECTRONIC SYSTEMS,IEEE Trans. Aerosp. Electron. Syst.
IEEE TRANSACTIONS ON ANTENNAS AND PROPAGATION,IEEE Trans. Antennas Propag.
IEEE ANTENNAS AND WIRELESS PROPAGATION LETTERS,IEEE Antennas Wireless Propag. Lett.
IEEE TRANSACTIONS ON APPLIED SUPERCONDUCTIVITY,IEEE Trans. Appl. Supercond.
"IEEE/ACM TRANSACTIONS ON AUDIO, SPEECH, AND LANGUAGE PROCESSING","IEEE/ACM Trans. Audio, Speech, Language Process."
"IEEE TRANSACTIONS ON AUDIO, SPEECH, AND LANGUAGE PROCESSING","IEEE Trans. Audio, Speech, Language Process."
IEEE TRANSACTIONS ON AUTOMATIC CONTROL,IEEE Trans. Autom. Control
IEEE TRANSACTIONS ON AUTOMATION SCIENCE AND ENGINEERING,IEEE Trans. Autom. Sci. Eng.
IEEE TRANSACTIONS ON AUTONOMOUS MENTAL DEVELOPMENT,IEEE Trans. Auton. Mental Develop.
IEEE TRANSACTIONS ON BIG DATA,IEEE Trans. Big Data
IEEE JOURNAL OF BIOMEDICAL AND HEALTH INFORMATICS,IEEE J. Biomed. Health Inform.
IEEE TRANSACTIONS ON BIOMEDICALCIRCUITS AND SYSTEMS,IEEE Trans. Biomed. Circuits Syst.
IEEE REVIEWS IN BIOMEDICAL ENGINEERING,IEEE Rev. Biomed. Eng.
IEEE TRANSACTIONS ON BIOMEDICAL ENGINEERING,IEEE Trans. Biomed. Eng.
IEEE TRANSACTIONS ON BROADCASTING,IEEE Trans. Broadcast.
IEEE TRANSACTIONS ON CIRCUITS AND SYSTEMS-I:REGULAR PAPERS,"IEEE Trans. Circuits Syst. I, Reg. Papers"
IEEE TRANSACTIONS ON CIRCUITS AND SYSTEMS-II: EXPRESS BRIEFS,"IEEE Trans. Circuits Syst. II, Exp. Briefs"
IEEE TRANSACTIONS ON CIRCUITS AND SYSTEMS-I: FUNDAMENTAL THEORY AND APPLICATIONS,"IEEE Trans. Circuits Syst. I, Fundam. Theory Appl."
IEEE TRANSACTIONS ON CIRCUITS AND SYSTEMS-II:ANALOG AND DIGITAL SIGNAL PROCESSING,"IEEE Trans. Circuits Syst. II, Analog Digit. Signal Process."
IEEE TRANSACTIONS ON CIRCUITS AND SYSTEMS FOR VIDEO TECHNOLOGY,IEEE Trans. Circuits Syst. Video Technol.
IEEE TRANSACTIONS ON CLOUD COMPUTING,IEEE Trans. Cloud Comput.
IEEE TRANSACTIONS ON COGNITIVE COMMUNICATIONS AND NETWORKING,IEEE Trans. Cogn. Commun. Netw.
IEEE TRANSACTIONS ON COMMUNICATIONS,IEEE Trans. Commun.
IEEE COMMUNICATIONS LETTERS,IEEE Commun. Lett.
IEEE COMMUNICATIONS SURVEYS &TUTORIALS,IEEE Commun. Surveys Tuts.
"IEEE TRANSACTIONS ON COMPONENTS, PACKAGING AND MANUFACTURING TECHNOLOGY",IEEE Trans. Compon. Packag. Manuf. Technol.
IEEE/ACMTRANSACTIONS ON COMPUTATIONAL BIOLOGY AND BIOINFORMATICS,IEEE/ACM Trans. Comput. Biol. Bioinf.
IEEE TRANSACTIONS ON COMPUTATIONAL INTELLIGENCE AND AI IN GAMES,IEEE Trans. Comput. Intell. AI in Games
IEEE TRANSACTIONS ON COMPUTATIONAL SOCIAL SYSTEMS,IEEE Trans. Comput. Social Syst.
IEEE TRANSACTIONS ON COMPUTERS,IEEE Trans. Comput.
IEEE TRANSACTIONS ON COMPUTER-AIDED DESIGN OF INTEGRATED CIRCUITS AND SYSTEMS,IEEE Trans. Comput.-Aided Design Integr. Circuits Syst.
IEEE COMPUTER ARCHITECTURAL LETTERS,IEEE Comput. Archit. Lett.
IEEE TRANSACTIONS ON CONSUMER ELECTRONICS,IEEE Trans. Consum. Electron.
IEEE TRANSACTIONS ON CONTROL SYSTEMS TECHNOLOGY,IEEE Trans. Control Syst. Technol.
IEEE TRANSACTIONS ON CYBERNETICS,IEEE Trans. Cybern.
IEEE TRANSACTIONS ON DEVICE AND MATERIALS RELIABILITY,IEEE Trans. Device Mater. Rel.
IEEE TRANSACTIONS ON DIELECTRICS AND ELECTRICAL INSULATION,IEEE Trans. Dielectr. Electr. Insul.
IEEE/OSA JOURNAL OF DISPLAY TECHNOLOGY,J. Display Technol.
IEEE TRANSACTIONS ON EDUCATION,IEEE Trans. Educ.
IEEE TRANSACTIONS ON ELECTROMAGNETIC COMPATIBILITY,IEEE Trans. Electromagn. Compat.
IEEE TRANSACTIONS ON ELECTRON DEVICES,IEEE Trans. Electron Devices
IEEE JOURNAL OF ELECTRON DEVICES SOCIETY,IEEE J. Electron Devices Soc.
IEEE ELECTRON DEVICE LETTERS,IEEE Electron Device Lett.
IEEE TRANSACTIONS ON ELECTRONICS PACKAGING MANUFACTURING,IEEE Trans. Electron. Packag. Manuf.
IEEE EMBEDDED SYSTEMS LETTERS,IEEE Embedded Syst. Lett.
IEEE TRANSACTIONS ON EMERGING TOPICS IN COMPUTING,IEEE Trans. Emerg. Topics Comput.
IEEE JOURNAL ON EMERGING AND SELECTED TOPICS IN CIRCUITS AND SYSTEMS,IEEE J. Emerg. Sel. Topics Circuits Syst.
IEEE JOURNAL ON EMERGING AND SELECTED TOPICS IN POWER ELECTRONICS,IEEE J. Emerg. Sel. Topics Power Electron.
IEEE TRANSACTIONS ON ENERGY CONVERSION,IEEE Trans. Energy Convers.
IEEE TRANSACTIONS ON ENGINEERING MANAGEMENT,IEEE Trans. Eng. Manag.
IEEE TRANSACTIONS ON EVOLUTIONARY COMPUTATION,IEEE Trans. Evol. Comput.
IEEE TRANSACTIONS ON EXPLORATORY SOLID-STATE COMPUTATIONAL DEVICES AND CIRCUITS,IEEE Trans. Explor. Solid-State Comput. Devices Circuits
IEEE TRANSACTIONS ON FUZZY SYSTEMS,IEEE Trans. Fuzzy Syst.
IEEE TRANSACTIONS ON GEOSCIENCE AND REMOTE SENSING,IEEE Trans. Geosci. Remote Sens.
IEEE GEOSCIENCE AND REMOTE SENSING LETTERS,IEEE Geosci. Remote Sens. Lett.
IEEE TRANSACTIONS ON HUMAN–MACHINE SYSTEMS,IEEE Trans. Human–Mach. Syst.
IEEE TRANSACTIONS ON IMAGE PROCESSING,IEEE Trans. Image Process.
IEEE TRANSACTIONS ON INDUSTRIAL ELECTRONICS,IEEE Trans. Ind. Electron.
IEEE TRANSACTIONS ON INDUSTRIAL INFORMATICS,IEEE Trans. Ind. Informat.
IEEE TRANSACTIONS ON INDUSTRY APPLICATIONS,IEEE Trans. Ind. Appl.
IEEE TRANSACTIONS ON INFORMATION FORENSICS AND SECURITY,IEEE Trans. Inf. Forensics Security
IEEE TRANSACTIONS ON INFORMATION THEORY,IEEE Trans. Inf. Theory
IEEE TRANSACTIONS ON INSTRUMENTATION AND MEASUREMENT,IEEE Trans. Instrum. Meas.
IEEE TRANSACTIONS ON INTELLIGENT TRANSPORTATION SYSTEMS,IEEE Trans. Intell. Transp. Syst.
IEEE INTERNET OF THINGS JOURNAL,IEEE Internet Things J.
IEEE TRANSACTIONS ON KNOWLEDGE AND DATA ENGINEERING,IEEE Trans. Knowl. Data Eng.
IEEE LIFE SCIENCES LETTERS,IEEE Life Sci. Lett.
IEEE/OSA JOURNAL OF LIGHTWAVE TECHNOLOGY,J. Lightw. Technol.
IEEE TRANSACTIONS ON MAGNETICS,IEEE Trans. Magn.
IEEE MAGNETICS LETTERS,IEEE Magn. Lett.
IEEE/ASME TRANSACTIONS ON MECHATRONICS,IEEE/ASME Trans. Mechatronics
IEEE TRANSACTIONS ON MEDICAL IMAGING,IEEE Trans. Med. Imag.
IEEE JOURNAL OF MICROELECTROMECHANICAL SYSTEMS,J. Microelectromech. Syst.
IEEE/ASME JOURNAL OF MICROELECTROMECHANICAL SYSTEMS,IEEE Microw. Compon. Lett.
IEEE MICROWAVE AND WIRELESS COMPONENTS LETTERS,IEEE Microw. Guided Wave Lett. 
IEEE TRANSACTIONS ON MICROWAVE THEORY AND TECHNIQUES,IEEE Trans. Microw. Theory Techn.
IEEE TRANSACTIONS ON MOBILE COMPUTING,IEEE Trans. Mobile Comput.
"IEEE TRANSACTIONS ONMOLECULAR, BIOLOGICAL AND MULTI-SCALE COMMUNICATIONS",IEEE Trans. Mol. Biol. Multi-Scale Commun.
IEEE TRANSACTIONS ON MULTIMEDIA,IEEE Trans. Multimedia
IEEE TRANSACTIONS ONMULTI-SCALE COMPUTING SYSTEMS,IEEE Trans. Multi-Scale Comput. Syst.
IEEE TRANSACTIONS ON NANOBIOSCIENCE,IEEE Trans. Nanobiosci.
IEEE TRANSACTIONS ON NANOTECHNOLOGY,IEEE Trans. Nanotechnol.
IEEE NANOTECHNOLOGY EXPRESS,IEEE Nanotechnol. Express
IEEE/ACM TRANSACTIONS ON NETWORKING,IEEE/ACM Trans. Netw.
IEEE TRANSACTIONS ON NEURAL NETWORKS AND LEARNING SYSTEMS,IEEE Trans. Neural Netw. Learn. Syst.
IEEE TRANSACTIONS ON NUCLEAR SCIENCE,IEEE Trans. Nucl. Sci.
IEEE TRANSACTIONS ON NEURAL SYSTEMS AND REHABILITATION ENGINEERING,IEEE Trans. Neural Syst. Rehabil. Eng.
IEEE JOURNAL OF OCEANIC ENGINEERING,IEEE J. Ocean. Eng.
IEEE JOURNAL OF OPTICAL COMMUNICATIONS AND NETWORKING,IEEE J. Opt. Commun. Netw.
IEEE TRANSACTIONS ON PARALLEL AND DISTRIBUTED SYSTEMS,IEEE Trans. Parallel Distrib. Syst.
IEEE TRANSACTIONS ON PATTERN ANALYSIS AND MACHINE INTELLIGENCE,IEEE Trans. Pattern Anal. Mach. Intell.
IEEE PHOTONICS TECHNOLOGY LETTERS,IEEE Photon. Technol. Lett.
IEEE PHOTONICS JOURNAL,IEEE Photon. J.
IEEE JOURNAL OF PHOTOVOLTAICS,IEEE J. Photovolt.
IEEE TRANSACTIONS ON PLASMA SCIENCE,IEEE Trans. Plasma Sci.
IEEE TRANSACTIONS ON POWER DELIVERY,IEEE Trans. Power Del.
IEEE TRANSACTIONS ON POWER ELECTRONICS,IEEE Trans. Power Electron.
IEEE TRANSACTIONS ON POWER SYSTEMS,IEEE Trans. Power Syst.
IEEE JOURNAL OF PRODUCT SAFETY ENGINEERING,IEEE J. Product Safety Eng.
IEEE POWER AND ENERGY TECHNOLOGY SYSTEMS JOURNAL,IEEE Power Energy Technol. Syst. J.
IEEE TRANSACTIONS ON PROFESSIONAL COMMUNICATION,IEEE Trans. Prof. Commun.
IEEE JOURNAL OF QUANTUM ELECTRONICS,IEEE J. Quantum Electron.
IEEE RFIC JOURNAL,IEEE RFIC J.
IEEE RFID JOURNAL,IEEE RFID J.
IEEE TRANSACTIONS ON RELIABILITY,IEEE Trans. Rel.
IEEE TRANSACTIONS ON ROBOTICS,IEEE Trans. Robot.
IEEE TRANSACTIONS ON ROBOTICS AND AUTOMATION,IEEE Trans. Robot. Autom. 
IEEE JOURNAL OF SELECTED TOPICS IN APPLIED EARTH OBSERVATIONS AND REMOTE SENSING,IEEE J. Sel. Topics Appl. Earth Observ. Remote Sens.
IEEE JOURNAL ON SELECTED AREAS IN COMMUNICATIONS,IEEE J. Sel. Areas Commun.
IEEE JOURNAL OF SELECTED TOPICS IN QUANTUM ELECTRONICS,IEEE J. Sel. Topics Quantum Electron.
IEEE JOURNAL OF SELECTED TOPICS IN SIGNAL PROCESSING,IEEE J. Sel. Topics Signal Process.
IEEE TRANSACTIONS ON SEMICONDUCTOR MANUFACTURING,IEEE Trans. Semicond. Manuf.
IEEE SENSORS JOURNAL,IEEE Sensors J.
IEEE TRANSACTIONS ON SIGNAL PROCESSING,IEEE Trans. Signal Process.
IEEE SIGNAL PROCESSING LETTERS,IEEE Signal Process. Lett.
IEEE TRANSACTIONS ON SMART GRID,IEEE Trans. Smart Grid
IEEE TRANSACTIONS ON SUSTAINABLE ENERGY,IEEE Trans. Sustain. Energy
IEEE SYSTEMS JOURNAL,IEEE Syst. J.
IEEE TRANSACTIONS ON SOFTWARE ENGINEERING,IEEE Trans. Softw. Eng.
IEEE JOURNAL OF SOLID-STATE CIRCUITS,IEEE J. Solid-State Circuits
"IEEE TRANSACTIONS ON SYSTEMS,MAN, AND CYBERNETICS: SYSTEMS","IEEE Trans. Syst., Man, Cybern.,Syst."
IEEE JOURNAL OF TRANSLATIONAL ENGINEERING IN HEALTH AND MEDICINE,IEEE J. Transl. Eng. Health Med.
IEEE TRANSLATION JOURNAL ON MAGNETICS IN JAPAN,IEEE Transl. J. Magn. Jpn.
IEEE JOURNAL ON TECHNOLOGY IN COMPUTER AIDED DESIGN,IEEE J. Technol. Computer Aided Des.
IEEE TRANSACTIONS ON TERAHERTZ SCIENCE AND TECHNOLOGY,IEEE Trans. THz Sci. Technol.
IEEE TRANSACTIONS ON TRANSPORTATION ELECTRIFICATION,IEEE Trans. Transport. Electrific.
"IEEE TRANSACTIONS ON ULTRASONICS, FERROELECTRICS, AND FREQUENCY CONTROL","IEEE Trans. Ultrason., Ferroelectr., Freq. Control"
IEEE TRANSACTIONS ON VEHICULAR TECHNOLOGY,IEEE Trans. Veh. Technol.
IEEE TRANSACTIONS ON VERY LARGE SCALE INTEGRATION (VLSI) SYSTEMS,IEEE Trans. Very Large Scale Integr. (VLSI) Syst.
IEEE TRANSACTIONS ON VISUALIZATION AND COMPUTER GRAPHICS,IEEE Trans. Vis. Comput. Graphics
IEEE TRANSACTIONS ON WIRELESS COMMUNICATIONS,IEEE Trans. Wireless Commun.
PROCEEDINGS OF THE IEEE,Proc. IEEE
IEEE Aerospace and Electronics Systems Magazine,IEEE Aerosp. Electron. Syst. Mag.
IEEE Annals of the History of Computing,IEEE Ann. Hist. Comput.
IEEE Antennas and Propagation Magazine,IEEE Antennas Propag. Mag.
IEEE ASSP Magazine ,IEEE ASSP Mag.
IEEE Circuits and Systems Magazine,IEEE Circuits Syst. Mag.
IEEE Circuits and Devices Magazine,IEEE Circuits Devices Mag.
IEEE Communications Society Magazine ,IEEE Commun. Soc. Mag.
IEEE Communications Magazine ,IEEE Commun. Mag.
IEEE Computational Intelligence Magazine,IEEE Comput. Intell. Mag.
IEEE Computing in Science and Engineering Magazine,IEEE Comput. Sci. Eng.
IEEE Computer Applications in Power,IEEE Comput. Appl. Power
IEEE Computer Graphics and Applications Magazine,IEEE Comput. Graph. Appl. Mag.
IEEE Consumer Electronics Magazine,IEEE Consum. Electron. Mag.
IEEE Control Systems Magazine,IEEE Control Syst. Mag.
IEEE Design & Test,IEEE Des. Test.
IEEE Electrical Insulation Magazine,IEEE Elect. Insul. Mag.
IEEE Electomagnetic Compatibility Magazine,IEEE Electrmagn. Compat.
IEEE Electrification Magazine,IEEE Electrific. Mag.
IEEE ElectroTechnology Review,IEEE ElectroTechnol. Rev.
IEEE Engineering Management Review,IEEE Eng. Manag. Rev.
IEEE Geoscience and Remote Sensing Magazine,IEEE Geosci. Remote Sens. Mag.
IEEE Industrial Electronics Magazine,IEEE Ind. Electron. Mag.
IEEE Industry Applications Magazine,IEEE Ind. Appl. Mag.
IEEE Instrumentation and Measurement Magazine,IEEE Instrum. Meas. Mag.
IEEE Intelligent Systems ,IEEE Intell. Syst.
IEEE Intelligent Transportation Systems Magazine,IEEE Intell. Transp. Syst. Mag.
IEEE Internet Computing Magazine,IEEE Internet Comput.
IEEE IT Professional,IEEE IT Prof.
IEEE Microwave Magazine,IEEE Microw. Mag.
IEEE MultiMedia Magazine,IEEE Multimedia Mag.
IEEE Nanotechnology Magazine,IEEE Nanotechnol. Mag.
IEEE Network,IEEE Netw.
IEEE Personal Communications,IEEE Pers. Commun.
IEEE Power Electronics Magazine,IEEE Power Electron. Mag.
IEEE Power and Energy Magazine,IEEE Power Energy Mag.
IEEE Power Engineering Review,IEEE Power Eng. Rev.
IEEE Robotics and Automation Magazine,IEEE Robot. Autom. Mag.
IEEE Signal Processing Magazine ,IEEE Signal Process. Mag.
IEEE Solid-State Circuits Magazine,IEEE Solid State Circuits Mag.
IEEE Software,IEEE Softw.
IEEE Spectrum,IEEE Spectr.
"IEEE Systems, Man, and Cybernetics Magazine","IEEE Syst., Man, Cybern. Mag."
IEEE Technology and Society Magazine,IEEE Technol. Soc. Mag.
IEEE Vehicular Technology Magazine,IEEE Veh. Technol. Mag.
China Communications Magazine,China Commun.
Internet Computing,Internet Comput.
IEEE Computer Magazine,IEEE Computer
IEEE Concurrency,IEEE Concurrency
IEEE Expert,IEEE Expert
IEEE Micro Magazine,IEEE Micro
IEEE Potentials,IEEE Potentials
IEEE Pulse,IEEE Pulse
IEEE Security and Privacy,IEEE Security Privacy
